{
  "schema_version": "1.0",
  "work_item_id": "TICKET-TO-PR-1",
  "spec": "docs/dev/TICKET-TO-PR-1/spec.json",
  "guidance": [
    {
      "directive": "Do not orchestrate phases via the Pi SDK. Phase orchestration MUST use `pi -p --mode json /skill:accord <phase> <ticket>` CLI subprocesses only; the SDK would roughly double the owned-code surface in unattended CI (session lifecycle, abort/signal handling, runtime/factory creation, bindExtensions) for limited gain. No `@mariozechner/pi-coding-agent` SDK symbol may be imported from `scripts/ci/`.",
      "source": "spec-rejected-alternative"
    },
    {
      "directive": "Do not distribute the autopipeline as a GitHub App. App installation requires hosted backend / webhook receiver per consumer org; a reusable workflow plus composite action gives consumers a 10-line opt-in with no central infrastructure on our side.",
      "source": "spec-rejected-alternative"
    },
    {
      "directive": "Do not distribute as a Docker action. Slower cold-start (image pull), harder for consumers to reproduce locally, worse iteration loop. The composite-action plus `scripts/ci/*.ts` approach is functionally equivalent and operationally cheaper.",
      "source": "spec-rejected-alternative"
    },
    {
      "directive": "Do not run a self-hosted webhook receiver for Jira events. Atlassian Automation natively supports `POST /repos/<owner>/<repo>/dispatches`; a self-hosted receiver adds operational burden, attack surface, and a single point of failure with zero behavioural benefit.",
      "source": "spec-rejected-alternative"
    },
    {
      "directive": "Do not auto-create follow-up Jira tickets when a phase returns `status: gaps`. Out of scope for v1 (deferred to v1.1). v1 only writes the structured `gaps[]` payload into a single terminal Jira comment (AC-10); authors decide whether to spawn follow-ups manually.",
      "source": "spec-rejected-alternative"
    },
    {
      "directive": "Do not write to Jira mid-run. No per-phase progress comments, no in-flight status transitions. Only terminal-state writes are permitted — the headless-agent contract requires a Jira comment to be an unambiguous terminal report.",
      "source": "spec-rejected-alternative"
    },
    {
      "directive": "Do not introduce a per-consumer prompt-level customisation surface for phase agents (e.g. swappable `phase-code` variants). v1 configuration surface is locked to `AGENTS.md` (`## Dev Harness` block) and `accord-config.json`; revisit for v2 once we have data on which prompts consumers most want to override.",
      "source": "spec-rejected-alternative"
    },
    {
      "directive": "Do not enable PR auto-merge after CI green. Compliance and SRE explicitly require human approval before an autonomous-agent commit lands on `main`. Auto-merge would change the trust contract; reviewers MUST remain in the loop. PRs may be opened as drafts where supported and never marked ready-for-review automatically.",
      "source": "spec-rejected-alternative"
    }
  ],
  "reuse_candidates": [],
  "tasks": [
    {
      "id": 1,
      "title": "scripts/ci/lib/env.ts secret-existence helper + tests/ci scaffolding",
      "covers_ac": ["AC-20", "AC-21", "AC-22", "AC-23", "AC-24", "AC-25"],
      "challenge": true,
      "depends_on": [],
      "files": [
        { "path": "scripts/ci/lib/env.ts", "action": "add" },
        { "path": "tests/ci/lib/env.test.ts", "action": "add" }
      ],
      "steps": [
        {
          "tag": "test",
          "description": "Write `tests/ci/lib/env.test.ts` covering each AC-20..AC-25 case: missing `ANTHROPIC_API_KEY` / `JIRA_BASE_URL` / `JIRA_USER_EMAIL` / `JIRA_API_TOKEN` / `GITHUB_TOKEN` each throws `MISSING_REQUIRED_SECRET: <NAME>` with non-zero exit; present values resolve to the env value; `GH_PAT_PR` is non-fatal in same-repo mode (returns undefined, falls back to `GITHUB_TOKEN`) and required-and-throwing in cross-repo mode (`MISSING_REQUIRED_SECRET: GH_PAT_PR`). Assert the error class is distinct enough to be caught by entrypoints and that the error message string format exactly matches `MISSING_REQUIRED_SECRET: <NAME>` (byte-for-byte, for downstream test asserts and operator grep)."
        },
        {
          "tag": "impl",
          "description": "Implement `scripts/ci/lib/env.ts` exporting `requireEnv(name: string): string` (throws `MissingSecretError` with literal message `MISSING_REQUIRED_SECRET: <NAME>`), `resolveGithubToken(opts: { crossRepo: boolean }): string` (returns `GH_PAT_PR` when set, otherwise `GITHUB_TOKEN`; throws when `crossRepo` and neither is set), and constant `SECRET_NAMES` listing the six secret identifiers. Throwing is synchronous and side-effect-free so callers can wrap startup in try/catch and translate to process exit non-zero before any LLM / Jira / GitHub call."
        },
        {
          "tag": "verify",
          "description": "Run `bun test tests/ci/lib/env.test.ts` and `bun run check:types`; both must pass with zero diagnostics."
        }
      ]
    },
    {
      "id": 2,
      "title": "Reusable workflow input surface, concurrency block, dispatch validation",
      "covers_ac": ["AC-1", "AC-15", "AC-19"],
      "challenge": false,
      "depends_on": [1],
      "files": [
        { "path": ".github/workflows/autopipeline.yml", "action": "add" },
        { "path": "scripts/ci/lib/inputs.ts", "action": "add" },
        { "path": "scripts/ci/dispatch.ts", "action": "add" },
        { "path": "tests/ci/inputs-and-concurrency.test.ts", "action": "add" },
        { "path": "tests/ci/dispatch-validation.test.ts", "action": "add" }
      ],
      "steps": [
        {
          "tag": "test",
          "description": "Write `tests/ci/inputs-and-concurrency.test.ts` (TC-13 + AC-15 surface check): parse `.github/workflows/autopipeline.yml` as YAML and assert (a) the `on.workflow_call.inputs` map matches exactly the AC-15 set with the AC-15 defaults (`ticket` required, `pi_version`=`latest`, `accord_ref`=`v1`, `max_runtime_minutes`=90, `max_cost_usd`=20, `base_branch`=`main`, `branch_prefix`=`accord/`, `dry_run`=false, `runner`=`ubuntu-latest`); (b) the `on.workflow_call.secrets` block declares `ANTHROPIC_API_KEY` / `JIRA_BASE_URL` / `JIRA_USER_EMAIL` / `JIRA_API_TOKEN` as required and `GH_PAT_PR` as optional; (c) `on.repository_dispatch.types` is `[accord-autopipeline]`; (d) the main job carries `concurrency.group: accord-${{ inputs.ticket }}` and `concurrency.cancel-in-progress: false`, no workflow-level concurrency block conflicts; (e) `permissions:` declares exactly `contents: write`, `pull-requests: write`, `issues: write`. Also write `tests/ci/dispatch-validation.test.ts` (TC-20): four synthetic payloads — workflow_call with `inputs.ticket`, repository_dispatch with `client_payload.ticket`+`status_at_trigger`, dispatch missing `ticket`, dispatch missing `status_at_trigger` — assert (a) and (b) pass through with the parsed `{ticket, statusAtTrigger}`, (c) and (d) exit non-zero with stderr containing `MISSING_REQUIRED_DISPATCH_FIELD: ticket` / `MISSING_REQUIRED_DISPATCH_FIELD: status_at_trigger` before any `pi` invocation (mock asserts zero subprocess spawns)."
        },
        {
          "tag": "impl",
          "description": "Author `scripts/ci/lib/inputs.ts` as the single source of truth for the AC-15 input set: an exported `INPUTS` const describing each input's name, type, default, and required-flag, plus a typed `Inputs` interface generated from it. Author `scripts/ci/dispatch.ts` exporting `readDispatch(event: GithubEventPayload): { ticket: string; statusAtTrigger: string | null }` that reads `inputs.ticket` for `workflow_call` and `client_payload.{ticket,status_at_trigger}` for `repository_dispatch`; throws `MISSING_REQUIRED_DISPATCH_FIELD: <name>` (printed to stderr, exit non-zero) when either field is absent on the dispatch path. Author `.github/workflows/autopipeline.yml` with the AC-15 input/secret surface, AC-1 dual triggers (`on.workflow_call` + `on.repository_dispatch.types: [accord-autopipeline]`), AC-19 concurrency block on the main job, and AC-15-mandated `permissions:` block (contents/pull-requests/issues write only). The job body at this stage is a single placeholder step that invokes `bun run scripts/ci/dispatch.ts` so dispatch validation fails the workflow before any LLM call; downstream tasks fill in subsequent steps."
        },
        {
          "tag": "verify",
          "description": "Run `bun test tests/ci/inputs-and-concurrency.test.ts tests/ci/dispatch-validation.test.ts` and `bun run check:types`; both must pass."
        }
      ]
    },
    {
      "id": 3,
      "title": "gate-agents-md.ts + gate-ticket.ts (deterministic pre-LLM gates)",
      "covers_ac": ["AC-2", "AC-3"],
      "challenge": false,
      "depends_on": [1],
      "files": [
        { "path": "scripts/ci/gate-agents-md.ts", "action": "add" },
        { "path": "scripts/ci/gate-ticket.ts", "action": "add" },
        { "path": "tests/ci/agents-md-gate.test.ts", "action": "add" },
        { "path": "tests/ci/gate-ticket.test.ts", "action": "add" },
        { "path": "tests/ci/fixtures/jira/gate-passing.json", "action": "add" }
      ],
      "steps": [
        {
          "tag": "test",